[
    {
        "url": "https://www.christianpost.com/news/media-meltdown-over-bible-museum-washington-post.html",
        "title": "A Media Meltdown Over the Bible Museum",
        "authors": [],
        "publisher": "https://www.christianpost.com",
        "publish_date": "",
        "text": "Go\nA Media Meltdown Over the Bible Museum\nA Media Meltdown Over the Bible Museum\n| Thursday, January 18, 2018\nThe press really hates this museum. \nSince the Museum of the Bible in Washington, D.C. opened, news outlets have been having a cow of biblical proportions. The Washington Post ran a piece faulting the museum for not devoting more space to skeptics:\n\"Bible narratives are presumed true,\" the reporter wrote, \"and there is little or no discussion of their manifold contradictions.\"\nRead more here:  https://www.christianpost.com/voice/is-this-americas-most-hated-museum.html\nMore In Entertainment\n",
        "quotes": [
            [
                "and there is little or no discussion of their manifold contradictions.",
                "",
                false
            ]
        ],
        "links": {
            "articles": [
                "https://www.christianpost.com/voice/is-this-americas-most-hated-museum.html"
            ],
            "gov_pgs": [],
            "unsure": []
        },
        "key_words": [
            "skepticsbible",
            "media",
            "museum",
            "meltdown",
            "stumbleupon",
            "bible",
            "reporter",
            "washington",
            "whatsapp",
            "wrote",
            "space",
            "true"
        ]
    }
]